{
  "schema_version": "1.0.0",
  "generated_at": "2026-10-30T12:15:48.732021Z",
  "skill_count": 6,
  "skills": [
    {
      "name": "arc:audit",
      "description": "Read-only evaluation (只读) that produces ranked, evidence-backed code findings and never edits code: review any diff, PR or branch (代码评审, 能不能合), project health, code rot, over-engineering and tech debt (体检, 技术债, 过度设计, 可删代码), HTTP API design review (接口设计, 上传约束, JSON字段限制), AppSec audit, threat model and source-first pen test (威胁建模, 渗透测试) across web, identity, client, cloud, CI, RPC, mobile and LLM-agent surfaces, secret, dependency and SAST scans (安全扫描, Semgrep, 漏洞), and authorized DAST. Business lifecycle gaps (状态机漏洞, 闭环检查) go to arc:plan model mode. Not for fixes (use arc:code), tests (use arc:verify), or posting comments on CNB pull requests (use cnb).",
      "version": "2.7.0",
      "source_path": "Arc/arc:audit/SKILL.md",
      "line_count": 148,
      "intent_router": [
        {
          "Condition": "HTTP API design, upload or JSON contract",
          "Mode": "api-design",
          "Read": "[api-design-review.md](references/api-design-review.md); also review if a diff is supplied"
        },
        {
          "Condition": "Diff, PR, branch, commit range or patch file",
          "Mode": "review",
          "Read": "[references/diff-review.md](references/diff-review.md); prior findings or `deep`: [review-loop.md](references/review-loop.md)"
        },
        {
          "Condition": "Health, code rot, over-engineering (过度设计), tech debt, maintainability, architecture or release readiness; \"审计/audit\" with no security word",
          "Mode": "health",
          "Read": "[../_shared/code-rot.md](../_shared/code-rot.md)"
        },
        {
          "Condition": "Security, vulnerability, AppSec, threat model, pen test, data exposure, AuthZ",
          "Mode": "appsec",
          "Read": "[references/appsec.md](references/appsec.md), [attack-classes.md](references/attack-classes.md)"
        },
        {
          "Condition": "Scanner name, secrets/dependency/SAST scan, DAST, re-scan",
          "Mode": "scan",
          "Read": "[references/scanners.md](references/scanners.md)"
        },
        {
          "Condition": "AppSec audit plus tool scans",
          "Mode": "appsec, then scan",
          "Read": "[references/appsec.md](references/appsec.md), [references/scanners.md](references/scanners.md)"
        }
      ],
      "quick_contract": null,
      "input_arguments": null,
      "outputs_section": null
    },
    {
      "name": "arc:code",
      "description": "Every task that changes source code: write code to implement (写代码, 实现, 开发功能, 落地改动) a feature, endpoint or page (前端, 落地页, 要好看, shadcn, 小程序) on the project's stack; fix (修复) a bug, error (报错), incident or failing test by evidence-first root-cause repair (根因); refactor (重构) or migrate; change an API or schema; apply Go backend layering (DIP, usecase, 分层); write comments (注释); add timing probes to a Gin SSR path (计时, 探针, 埋点); or build TypeSafe classifiers and routers (分类器, 意图识别). Implements an existing DESIGN.md. Ends with the gate.sh completion check. Not for read-only review (use arc:audit), tests as the deliverable or release evidence (use arc:verify), PRDs, task docs or closure models (use arc:plan), visual direction without code (use ui-design), or commit, push and PR delivery (use check).",
      "version": "2.7.0",
      "source_path": "Arc/arc:code/SKILL.md",
      "line_count": 157,
      "intent_router": [
        {
          "Condition": "New feature, endpoint, job or behavior from a known requirement",
          "Mode": "implement",
          "Read": "the \"adds to mode\" rows below"
        },
        {
          "Condition": "Bug, error, crash, failing test, regression, incident, failure-justified optimization",
          "Mode": "repair",
          "Read": "[repair.md](references/repair.md) + evidence-first root-cause repair in [execution-truth.md](../../docs/execution-truth.md) §6"
        },
        {
          "Condition": "Refactor, rename, move, migrate; shape change of an API, DTO, schema, event or config key",
          "Mode": "refactor",
          "Read": "[refactor.md](references/refactor.md)"
        },
        {
          "Condition": "Web, mobile, desktop or mini-program page, component, state or theme",
          "Mode": "frontend",
          "Read": "[frontend.md](../_shared/conventions/frontend.md); theme: [frontend-tokens.md](../_shared/conventions/frontend-tokens.md); a project `DESIGN.md` sets visual rules only"
        },
        {
          "Condition": "Add or correct code comments only",
          "Mode": "comment",
          "Read": "[comments.md](../_shared/conventions/comments.md)"
        },
        {
          "Condition": "Timing probes on a slow request path",
          "Mode": "probe",
          "Read": "[perf-probes.md](references/perf-probes.md)"
        },
        {
          "Condition": "Any mode editing Go backend code",
          "Mode": "adds to mode",
          "Read": "[go-backend.md](../_shared/conventions/go-backend.md) + [go-type-safety.md](../_shared/conventions/go-type-safety.md)"
        },
        {
          "Condition": "New Go module, composition root or wiring, mappers, constructor naming",
          "Mode": "adds to mode",
          "Read": "[go-backend-structure.md](../_shared/conventions/go-backend-structure.md)"
        },
        {
          "Condition": "Add/change an API",
          "Mode": "adds to mode",
          "Read": "[api-contract.md](../_shared/api-contract.md) with its HTTP/JSON/upload rules"
        },
        {
          "Condition": "Any mode writing SQL, transactions, migrations or state transitions",
          "Mode": "adds to mode",
          "Read": "[code-rot.md](../_shared/code-rot.md) families D and E; record how each applicable item is met before writing"
        },
        {
          "Condition": "Change touches behavior modeled in a closure spec",
          "Mode": "adds to mode",
          "Read": "[workflow.md](../_shared/workflow.md) §4: run the plan model gate first"
        },
        {
          "Condition": "Feature needs semantic judgment: classify, route, score, extract, verify (分类器, 意图识别)",
          "Mode": "adds to mode",
          "Read": "`typesafe-ai` skill and its live docs before any integration code"
        }
      ],
      "quick_contract": null,
      "input_arguments": null,
      "outputs_section": null
    },
    {
      "name": "arc:explore",
      "description": "Read-only code intelligence for a local repository: find where code lives (代码在哪, 搜代码), locate definitions, list callers (谁调用), trace a call chain (调用链) or data flow, list everything a planned change would touch (影响面 / impact analysis), and draw a module or architecture map (架构地图). Also maintains the arc-idx / zoekt index (索引维护: doctor, index, daemon). Not for edits (use arc:code), read-only risk review (use arc:audit), or tests (use arc:verify).",
      "version": "2.3.0",
      "source_path": "Arc/arc:explore/SKILL.md",
      "line_count": 181,
      "intent_router": [
        {
          "Condition": "Question contains 改, 换, 删, 重命名, rename, remove, replace, or asks what a change touches (影响面)",
          "Mode": "impact",
          "Read": "[code-intel §4](../_shared/code-intel.md#4-impact-checklist)"
        },
        {
          "Condition": "Who calls X, call chain, data flow (谁调用, 调用链)",
          "Mode": "trace",
          "Read": "[code-intel §4 rows 1–4](../_shared/code-intel.md#4-impact-checklist)"
        },
        {
          "Condition": "Where a file, definition or string lives (代码在哪, 搜代码, 找符号)",
          "Mode": "locate",
          "Read": "[code-intel §3](../_shared/code-intel.md#3-query-ladder-stop-at-the-first-rung-that-answers-the-question)"
        },
        {
          "Condition": "Module or system structure, entry points, layers (架构地图, 模块梳理)",
          "Mode": "map",
          "Read": "[references/architecture-map.md](references/architecture-map.md)"
        },
        {
          "Condition": "doctor, index, daemon, stale or suspicious results, index config",
          "Mode": "index-ops",
          "Read": "[code-intel §1](../_shared/code-intel.md#1-preflight-once-per-repository-per-session)"
        }
      ],
      "quick_contract": null,
      "input_arguments": null,
      "outputs_section": null
    },
    {
      "name": "arc:plan",
      "description": "Turns intent into written specs and checkable models without touching source code: PRD or blueprint (写PRD, 立项, 需求文档), clarify a vague request into a brief with acceptance criteria (需求澄清, 验收标准), business closure models — design a lifecycle or check an existing flow for dead ends, missing compensation or illegal transitions (业务闭环, 状态机, 状态流转漏洞, 事件联动, 异常恢复, 闭环检查) with the closure checker and gate (闭环闸门), Markdown API contracts (接口契约, 接口文档), tasks (拆任务, 任务文档, 进度跟踪), and audit findings into task batches. Not for implementation (use arc:code), code review (use arc:audit), or Lark workspace sync (use lark).",
      "version": "2.6.0",
      "source_path": "Arc/arc:plan/SKILL.md",
      "line_count": 199,
      "intent_router": [
        {
          "Condition": "Idea or product needs a PRD, or an existing PRD must be refreshed",
          "Mode": "prd",
          "Read": "[prd.md](references/prd.md)"
        },
        {
          "Condition": "Request lacks goal, scope, constraints or acceptance; T2 work needs a brief",
          "Mode": "brief",
          "Read": "[brief.md](references/brief.md)"
        },
        {
          "Condition": "Design or change a business lifecycle: states, events, invariants, recovery (业务闭环, 状态机)",
          "Mode": "model",
          "Read": "[closure-design.md](references/closure-design.md), [closure-spec-format.md](references/closure-spec-format.md)"
        },
        {
          "Condition": "Check an existing flow for lifecycle gaps, read-only (状态流转漏洞, 闭环检查)",